{
  "versao": "1.0",
  "id_mensagem": "7c9d2e4f-1a3b-4c5d-8e6f-0a1b2c3d4e5f",
  "dispositivo": "solo-talhao07-02",
  "tipo": "evento",
  "timestamp": "2026-10-19T05:12:00Z",
  "via": "borda-fazenda-boa-vista",
  "evento": {
    "nome": "irrigacao_ligada",
    "severidade": "info",
    "detalhes": { "regra": "irrigacao-talhao07", "umidade_solo": 17.9 }
  }
}
